Courses registration session:,7/7/2021-10/7/2021
ID,Course name,Teacher name,Number of credits,Max students,Day of the week,Session
CSC10001,Ky Thuat Lap Trinh,Nguyen Le Hoang Dung,4,150,FRI,S3-S4
MTH00030,Dai So Tuyen Tinh,Le Van Hop,3,150,TUE,S1-S2
MTH00082,TH Vi Tich Phan 2B,Le Van Chanh,1,40,SAT,S1-S2
BAA00003,Tu Tuong Ho Chi Minh,Nguyen Cao Thien Bao,2,100,MON,S3-S4
CSC10002,TH Ky Thuat Lap Trinh,Le Tuan Thu,1,40,WED,S3-S4
GEO00002,Khoa hoc Trai Dat,Nguyen Van A,2,106,MON,S1-S2
CHE00002,Hoa dai cuong 2,Nguyen Thi B,3,70,MON,S1-S2
ENV00001,Moi truong dai cuong,Nguyen Van F,2,175,TUE,S1-S2
CSC00003,Tin hoc co so,Nguyen Van G,3,29,WED,S3-S4
